question,sql
What are the names of students who have taken the prerequisite for the course International Finance?,SELECT `t1`.`name` FROM `student` AS `t1` JOIN `takes` AS `t2` ON `t1`.`id` = `t2`.`id` WHERE `t2`.`course_id` IN (SELECT `t4`.`prereq_id` FROM `course` AS `t3` JOIN `prereq` AS `t4` ON `t3`.`course_id` = `t4`.`course_id` WHERE `t3`.`title` = 'International Finance')
Find the name and salary of instructors whose salary is below the average salary of the instructors in the Physics department.,"SELECT `name`, `salary` FROM `instructor` WHERE `salary` < (SELECT AVG(`salary`) FROM `instructor` WHERE `dept_name` = 'Physics')"
What are the names and salaries for instructors who earn less than the average salary of instructors in the Physics department?,"SELECT `name`, `salary` FROM `instructor` WHERE `salary` < (SELECT AVG(`salary`) FROM `instructor` WHERE `dept_name` = 'Physics')"
Find the name of students who took some course offered by Statistics department.,SELECT `t3`.`name` FROM `course` AS `t1` JOIN `takes` AS `t2` ON `t1`.`course_id` = `t2`.`course_id` JOIN `student` AS `t3` ON `t2`.`id` = `t3`.`id` WHERE `t1`.`dept_name` = 'Statistics'
What are the names of students who have taken Statistics courses?,SELECT `t3`.`name` FROM `course` AS `t1` JOIN `takes` AS `t2` ON `t1`.`course_id` = `t2`.`course_id` JOIN `student` AS `t3` ON `t2`.`id` = `t3`.`id` WHERE `t1`.`dept_name` = 'Statistics'
"Find the building, room number, semester and year of all courses offered by Psychology department sorted by course titles.","SELECT `t2`.`building`, `t2`.`room_number`, `t2`.`semester`, `t2`.`year` FROM `course` AS `t1` JOIN `section` AS `t2` ON `t1`.`course_id` = `t2`.`course_id` WHERE `t1`.`dept_name` = 'Psychology' ORDER BY `t1`.`title`"
"What are the building, room number, semester and year of courses in the Psychology department, sorted using course title?","SELECT `t2`.`building`, `t2`.`room_number`, `t2`.`semester`, `t2`.`year` FROM `course` AS `t1` JOIN `section` AS `t2` ON `t1`.`course_id` = `t2`.`course_id` WHERE `t1`.`dept_name` = 'Psychology' ORDER BY `t1`.`title`"
Find the names of all instructors in computer science department,SELECT `name` FROM `instructor` WHERE `dept_name` = 'Comp. Sci.'
What are the names of all instructors in the Comp. Sci. department?,SELECT `name` FROM `instructor` WHERE `dept_name` = 'Comp. Sci.'
Find the names of all instructors in Comp. Sci. department with salary > 80000.,SELECT `name` FROM `instructor` WHERE `dept_name` = 'Comp. Sci.' AND `salary` > 80000
What are the names of the instructors in the Comp. Sci. department who earn more than 80000?,SELECT `name` FROM `instructor` WHERE `dept_name` = 'Comp. Sci.' AND `salary` > 80000
Find the names of all instructors who have taught some course and the course_id.,"SELECT `name`, `course_id` FROM `instructor` AS `t1` JOIN `teaches` AS `t2` ON `t1`.`ID` = `t2`.`ID`"
"What are the names of all instructors who have taught a course, as well as the corresponding course id?","SELECT `name`, `course_id` FROM `instructor` AS `t1` JOIN `teaches` AS `t2` ON `t1`.`ID` = `t2`.`ID`"
Find the names of all instructors in the Art department who have taught some course and the course_id.,"SELECT `name`, `course_id` FROM `instructor` AS `t1` JOIN `teaches` AS `t2` ON `t1`.`ID` = `t2`.`ID` WHERE `t1`.`dept_name` = 'Art'"
"What are the names of Art instructors who have taught a course, and the corresponding course id?","SELECT `name`, `course_id` FROM `instructor` AS `t1` JOIN `teaches` AS `t2` ON `t1`.`ID` = `t2`.`ID` WHERE `t1`.`dept_name` = 'Art'"
Find the names of all instructors whose name includes the substring “dar”.,SELECT `name` FROM `instructor` WHERE `name` LIKE '%dar%'
"What are the names of all instructors with names that include ""dar""?",SELECT `name` FROM `instructor` WHERE `name` LIKE '%dar%'
List in alphabetic order the names of all distinct instructors.,SELECT DISTINCT `name` FROM `instructor` ORDER BY `name`
"List the distinct names of the instructors, ordered by name.",SELECT DISTINCT `name` FROM `instructor` ORDER BY `name`
Find courses that ran in Fall 2009 or in Spring 2010.,SELECT `course_id` FROM `section` WHERE `semester` = 'Fall' AND `YEAR` = 2009 UNION SELECT `course_id` FROM `section` WHERE `semester` = 'Spring' AND `YEAR` = 2010
What are the ids for courses in the Fall of 2009 or the Spring of 2010?,SELECT `course_id` FROM `section` WHERE `semester` = 'Fall' AND `YEAR` = 2009 UNION SELECT `course_id` FROM `section` WHERE `semester` = 'Spring' AND `YEAR` = 2010
Find courses that ran in Fall 2009 and in Spring 2010.,SELECT `course_id` FROM `section` WHERE `semester` = 'Fall' AND `YEAR` = 2009 INTERSECT SELECT `course_id` FROM `section` WHERE `semester` = 'Spring' AND `YEAR` = 2010
What are the ids for courses that were offered in both Fall of 2009 and Spring of 2010?,SELECT `course_id` FROM `section` WHERE `semester` = 'Fall' AND `YEAR` = 2009 INTERSECT SELECT `course_id` FROM `section` WHERE `semester` = 'Spring' AND `YEAR` = 2010
Find courses that ran in Fall 2009 but not in Spring 2010.,SELECT `course_id` FROM `section` WHERE `semester` = 'Fall' AND `YEAR` = 2009 EXCEPT SELECT `course_id` FROM `section` WHERE `semester` = 'Spring' AND `YEAR` = 2010
What are the ids of courses offered in Fall of 2009 but not in Spring of 2010?,SELECT `course_id` FROM `section` WHERE `semester` = 'Fall' AND `YEAR` = 2009 EXCEPT SELECT `course_id` FROM `section` WHERE `semester` = 'Spring' AND `YEAR` = 2010
Find the salaries of all distinct instructors that are less than the largest salary.,SELECT DISTINCT `salary` FROM `instructor` WHERE `salary` < (SELECT MAX(`salary`) FROM `instructor`)
What are the distinct salaries of all instructors who earned less than the maximum salary?,SELECT DISTINCT `salary` FROM `instructor` WHERE `salary` < (SELECT MAX(`salary`) FROM `instructor`)
Find the total number of instructors who teach a course in the Spring 2010 semester.,SELECT COUNT(DISTINCT `ID`) FROM `teaches` WHERE `semester` = 'Spring' AND `YEAR` = 2010
How many instructors teach a course in the Spring of 2010?,SELECT COUNT(DISTINCT `ID`) FROM `teaches` WHERE `semester` = 'Spring' AND `YEAR` = 2010
Find the names and average salaries of all departments whose average salary is greater than 42000.,"SELECT `dept_name`, AVG(`salary`) FROM `instructor` GROUP BY `dept_name` HAVING AVG(`salary`) > 42000"
What are the names and average salaries for departments with average salary higher than 42000?,"SELECT `dept_name`, AVG(`salary`) FROM `instructor` GROUP BY `dept_name` HAVING AVG(`salary`) > 42000"
Find names of instructors with salary greater than that of some (at least one) instructor in the Biology department.,SELECT `name` FROM `instructor` WHERE `salary` > (SELECT MIN(`salary`) FROM `instructor` WHERE `dept_name` = 'Biology')
What are the names of instructors who earn more than at least one instructor from the Biology department?,SELECT `name` FROM `instructor` WHERE `salary` > (SELECT MIN(`salary`) FROM `instructor` WHERE `dept_name` = 'Biology')
Find the names of all instructors whose salary is greater than the salary of all instructors in the Biology department.,SELECT `name` FROM `instructor` WHERE `salary` > (SELECT MAX(`salary`) FROM `instructor` WHERE `dept_name` = 'Biology')
What are the names of all instructors with a higher salary than any of the instructors in the Biology department?,SELECT `name` FROM `instructor` WHERE `salary` > (SELECT MAX(`salary`) FROM `instructor` WHERE `dept_name` = 'Biology')
